{
  "schemaVersion": "price-observation/1",
  "feedRef": "paper.aave-ausd-usd",
  "connectorRef": "paper.aave",
  "connectorVersion": "1.0.0",
  "networkRef": "monad-mainnet",
  "sourceEventKey": "143:0x69a5f9ad4f96ebf0a0c792dd42a01cc5c0102fef:0x47acca6d92db0c33653ffeefb809f32898c7864f2eae006087660283a94f6493:aave-native-oracle",
  "poolAddress": "0x69a5f9ad4f96ebf0a0c792dd42a01cc5c0102fef",
  "finality": "finalized",
  "method": "aave-native-oracle",
  "windowSeconds": 0,
  "reserve": {
    "assetAddress": "0x00000000efe302beaa2b3e6e1b18d08d69a9012a",
    "oracleAddress": "0x0c02b2c2038066c10eab8fe1d5cdb73d5a78a1bf",
    "oracleSourceAddress": "0x6b7c151653c35845a5826b15435fc055a9db1d0c",
    "priceUpdateTimeAvailable": false,
    "supplyRateRay": "35227413776935138278216668",
    "variableBorrowRateRay": "49460571963472369928961921",
    "lastUpdateAt": "2026-10-12T16:10:41.000Z"
  },
  "price": {
    "baseAssetRef": "paper.AUSD",
    "quoteUnit": "USD",
    "decimal": "0.9998126"
  },
  "observedAt": "2026-10-12T17:50:46.000Z",
  "receivedAt": "2026-10-12T17:50:51.136Z",
  "block": {
    "chainId": 143,
    "number": "112818856",
    "hash": "0x47acca6d92db0c33653ffeefb809f32898c7864f2eae006087660283a94f6493"
  },
  "provenanceHash": "0xadd57dbffd55e4020eae07699852ea38049fb37ce7a0bbe1cbb25fad6ccb54a6"
}
